<?xml version="1.0"?>
<xs:schema xmlns:xs="http://www.w3.org/2001/XMLSchema">
<xs:element name="Chefkoch">
<xs:complexType>
<xs:sequence>
<xs:element name="Rezept">
<xs:complexType>
<xs:sequence>
	<xs:element name="Allgemeines">
		<xs:complexType>
			<xs:sequence>
				<xs:element name="Rezeptname" type="xs:string"/>
				<xs:element name="Autor" type="xs:string"/>
			</xs:sequence>
		</xs:complexType>	
	</xs:element>
	
	<xs:element name="Zutaten">
		<xs:complexType>
			<xs:sequence>
				<xs:element name="Zutat" type="xs:string"/>
				<xs:element name="Gewicht" type="xs:integer"/>
				<xs:element name="Einheit" type="xs:string"/>
			</xs:sequence>
		</xs:complexType>
	</xs:element>
	

	<xs:element name="Portionen">
		<xs:simpleType>
 		   <xs:restriction base="xs:integer">
      			<xs:minInclusive value="0"/>
      			<xs:maxInclusive value="20"/>
    		</xs:restriction>
  		</xs:simpleType>
	</xs:element>
		
		
	<xs:element name="Zubereitung">
		<xs:complexType>
			<xs:sequence>	
				<xs:element name="Arbeitszeit" type="xs:time"/>
				<xs:element name="Schwierigkeitsgrad" type="xs:string"/>
				<xs:element name="Brennwert-p.P" type="xs:integer"/>
				<xs:element name="VorgÃ¤nge" type="xs:string"/>	
			</xs:sequence>
		</xs:complexType>
	</xs:element>
	
			
	<xs:element name="Kommentieren">	
		<xs:complexType>
			<xs:sequence>
				<xs:element name="Name" type="xs:string"/>
				<xs:element name="Datum" type="xs:date"/>
				<xs:element name="Zeit" type="xs:time"/>
				<xs:element name="Kommentare" type="xs:string"/>
			</xs:sequence>
			<xs:attribute name="Kommentar_hilfreich">
  					<xs:simpleType>
   						<xs:restriction base="xs:string">
   							<xs:pattern value="ja|nein"/>
 						</xs:restriction>
					</xs:simpleType>
			</xs:attribute>
		</xs:complexType>			
	</xs:element>
	
</xs:sequence>
</xs:complexType>
</xs:element>
</xs:sequence>
</xs:complexType>
</xs:element>
</xs:schema>