<?xml version="1.0" encoding="UTF-8"?>
<Chefkoch xmlns:xsi="http://www.w3.org/2001/XMLSchema-instance" xsi:noNamespaceSchemaLocation="Aufgabe3d.xsd">
  <Rezept>
    <Allgemeines>
      <Rezeptname>Rezeptname</Rezeptname>
      <Autor>Autor</Autor>
    </Allgemeines>
    <Zutaten>
      <Zutat>Zutat</Zutat>
      <Gewicht>0</Gewicht>
      <Einheit>Einheit</Einheit>
    </Zutaten>
    <Portionen>0</Portionen>
    <Zubereitung>
      <Arbeitszeit>12:00:00</Arbeitszeit>
      <Schwierigkeitsgrad>Schwierigkeitsgrad</Schwierigkeitsgrad>
      <Brennwert-p.P>0</Brennwert-p.P>
      <Vorgänge>Vorgänge</Vorgänge>
    </Zubereitung>
    <Kommentieren>
      <Name>Name</Name>
      <Datum>2001-01-01</Datum>
      <Zeit>12:00:00</Zeit>
      <Kommentare>Kommentare</Kommentare>
    </Kommentieren>
  </Rezept>
</Chefkoch>
